{
  "$schema": "http://json-schema.org/draft-07/schema#",
  "title": "Selector Decision v1",
  "description": "Advisory gearbox selector output. Selector output is not trade approval.",
  "type": "object",
  "additionalProperties": false,
  "required": [
    "schema_version",
    "decision_id",
    "selected_gear",
    "eligible_gears",
    "rejected_gears",
    "reason_codes",
    "protective_idle_allowed",
    "evidence_snapshot_ref",
    "no_trade_approval",
    "decision_scope"
  ],
  "properties": {
    "schema_version": {
      "const": "selector_decision.v1"
    },
    "decision_id": {
      "type": "string",
      "minLength": 8,
      "maxLength": 128
    },
    "selected_gear": {
      "type": ["string", "null"],
      "pattern": "^gear-[a-z0-9][a-z0-9_-]{2,80}$"
    },
    "eligible_gears": {
      "type": "array",
      "uniqueItems": true,
      "items": {
        "type": "string",
        "pattern": "^gear-[a-z0-9][a-z0-9_-]{2,80}$"
      }
    },
    "rejected_gears": {
      "type": "array",
      "items": {
        "type": "object",
        "additionalProperties": false,
        "required": ["gear_id", "reason_codes"],
        "properties": {
          "gear_id": {
            "type": "string",
            "pattern": "^gear-[a-z0-9][a-z0-9_-]{2,80}$"
          },
          "reason_codes": {
            "type": "array",
            "minItems": 1,
            "uniqueItems": true,
            "items": { "$ref": "#/definitions/gear_reason_code" }
          }
        }
      }
    },
    "reason_codes": {
      "type": "array",
      "uniqueItems": true,
      "items": { "$ref": "#/definitions/gear_reason_code" }
    },
    "protective_idle_allowed": {
      "const": true
    },
    "evidence_snapshot_ref": {
      "type": "string",
      "minLength": 1
    },
    "no_trade_approval": {
      "const": true
    },
    "decision_scope": {
      "type": "object",
      "additionalProperties": false,
      "required": ["symbol", "timeframe", "evaluation_window_ref"],
      "properties": {
        "symbol": {
          "type": "string",
          "pattern": "^[A-Z0-9]{3,20}$"
        },
        "timeframe": {
          "type": "string",
          "minLength": 1,
          "maxLength": 20
        },
        "evaluation_window_ref": {
          "type": "string",
          "minLength": 1
        }
      }
    }
  },
  "definitions": {
    "gear_reason_code": {
      "type": "string",
      "enum": [
        "SELECTED",
        "PARKED",
        "BLOCKED",
        "IDLE",
        "EVIDENCE_GAP",
        "RISK_BLOCKED",
        "REGIME_MISMATCH",
        "NOT_RUNTIME_READY",
        "DATA_STALE",
        "CORRELATION_RISK",
        "SLEEVE_LIMIT"
      ]
    }
  }
}
